{
  "$schema": "http://json-schema.org/draft-07/schema#",
  "title": "WeaponType",
  "description": "Data schema for a top-level Legendary Weapon Type classification in Cardinal Weapon Framework.",
  "type": "object",
  "properties": {
    "id": {
      "type": "string",
      "description": "Unique identifier for the weapon type (e.g., 'CW_WT_SWORD', 'CW_WT_SHIELD')."
    },
    "name": {
      "type": "string",
      "description": "Display name of the weapon type."
    },
    "description": {
      "type": "string",
      "description": "Summary description of the weapon type category."
    },
    "iconAsset": {
      "type": "string",
      "description": "Path to visual icon asset used in UI."
    },
    "baseSeriesIds": {
      "type": "array",
      "items": {
        "type": "string"
      },
      "description": "List of default Series IDs associated with this Weapon Type."
    }
  },
  "required": ["id", "name"],
  "additionalProperties": false
}
